id,title,author,author_birth_year,author_death_year,downloads
525,"Youth, a Narrative","Conrad, Joseph",1857,1924,293
697,The Light Princess,"MacDonald, George",1824,1905,293
4943,The River War: An Account of the Reconquest of the Sudan,"Churchill, Winston",1874,1965,292
5117,The Meaning of Truth,"James, William",1842,1910,292
13650,Nonsense Books,"Lear, Edward",1812,1888,292
53419,Twenty-Five Ghost Stories,,0,0,292
3409,Barchester Towers,"Trollope, Anthony",1815,1882,292
28617,Astounding Stories of Super-Science February 1930,Various,0,0,292
20058,The Napoleon of Notting Hill,"Chesterton, G. K. (Gilbert Keith)",1874,1936,291
38813,"The Works of Robert G. Ingersoll, Complete Contents: Dresden Edition-Twelve Volumes","Ingersoll, Robert Green",1833,1899,291
56166,Word Portraits of Famous Writers,,0,0,291
38315,Artistic Anatomy of Animals,"Cuyer, Edouard",1852,0,290
14766,McGuffey's Third Eclectic Reader,"McGuffey, William Holmes",1800,1873,290
3638,The Devil's Disciple,"Shaw, Bernard",1856,1950,290
54824,"The Secret Doctrine, Vol. 1 of 4","Blavatsky, H. P. (Helena Petrovna)",1831,1891,289
42390,The Myths of the North American Indians,"Spence, Lewis",1874,1955,289
2233,A Damsel in Distress,"Wodehouse, P. G. (Pelham Grenville)",1881,1975,289
3742,The Writings of Thomas Paine - Volume 2 (1779-1792): The Rights of Man,"Paine, Thomas",1737,1809,288
47297,Parzival: A Knightly Epic (vol. 1 of 2),"Wolfram, von Eschenbach, active 12th century",0,0,288
44325,The Great American Fraud: The Patent Medicine Evil,"Adams, Samuel Hopkins",1871,1958,287
12996,True Version of the Philippine Revolution,"Aguinaldo, Emilio",1869,1964,287
30255,The Skull,"Dick, Philip K.",1928,1982,287
25509,The World's Greatest Books - Volume 15 - Science,,0,0,287
14837,The Tale of Tom Kitten,"Potter, Beatrix",1866,1943,287
56795,The Story-book of Science,"Fabre, Jean-Henri",1823,1915,286
2667,The Vicar of Wakefield,"Goldsmith, Oliver",0,1774,286
58846,Kate Aylesford: A Story of the Refugees,"Peterson, Charles J.",0,0,286
4540,In His Steps,"Sheldon, Charles M.",1857,1946,286
7464,The Adventures of Sally,"Wodehouse, P. G. (Pelham Grenville)",1881,1975,286
58897,"The master of St. Benedict's, Vol. 1 (of 2)","Aubyn, Alan St.",0,0,285
56463,"Bacon's Essays, and Wisdom of the Ancients","Bacon, Francis",1561,1626,285
57284,Manual of Classical Erotology (De figuris Veneris),"Forberg, Friedrich Karl",0,0,285
47018,"A Dictionary of Slang, Cant, and Vulgar Words","Hotten, John Camden",1832,1873,285
41006,The Fairy Mythology,"Keightley, Thomas",1789,1872,285
58837,Adventures of Two Youths in a Journey to Egypt and the Holy Land,"Knox, Thomas Wallace",1835,1896,285
6043,The Spanish Tragedie,"Kyd, Thomas",1558,1594,285
3154,The Surprising Adventures of Baron Munchausen,"Raspe, Rudolf Erich",1737,1794,285
269,Beasts and Super-Beasts,Saki,1870,1916,285
34580,The Ego and His Own,"Stirner, Max",1806,1856,285
6753,Psmith in the City,"Wodehouse, P. G. (Pelham Grenville)",1881,1975,285
37925,"A Narrative of the Life of David Crockett, of the State of Tennessee.","Crockett, Davy",1786,1836,284
37288,Virginia Architecture in the Seventeenth Century,"Forman, Henry Chandlee",1904,1991,284
29345,Mountain Interval,"Frost, Robert",1874,1963,284
3261,News from Nowhere: Being Some Chapters from a Utopian Romance,"Morris, William",1834,1896,284
3741,The Writings of Thomas Paine - Volume 1 (1774-1779): The American Crisis,"Paine, Thomas",1737,1809,284
2853,Quo Vadis: A Narrative of the Time of Nero,"Sienkiewicz, Henryk",1846,1916,284
32571,Hans Andersen's Fairy Tales. First Series,"Andersen, H. C. (Hans Christian)",1805,1875,283
15665,New Latin Grammar,"Bennett, Charles E. (Charles Edwin)",1858,1921,283
21959,Letters from a Self-Made Merchant to His Son,"Lorimer, George Horace",1869,1937,283
14358,A Little Book of Filipino Riddles,,0,0,283
8714,Four Plays of Aeschylus,Aeschylus,-525,-456,282
58807,Index of the Project Gutenberg Works of Ambrose Bierce,"Bierce, Ambrose",1842,1913,282
44704,The World's Greatest Books - Volume 20 - Miscellaneous Literature and Index,,0,0,282
2462,Dona Perfecta,"Perez Galdos, Benito",1843,1920,282
22914,The Sceptical Chymist,"Boyle, Robert",1627,1691,281
2765,The Lady from the Sea,"Ibsen, Henrik",1828,1906,281
982,The Book of Nonsense,"Lear, Edward",1812,1888,281
28513,The Wonders of the Invisible World,"Mather, Increase",1639,1723,281
2726,Eight Cousins,"Alcott, Louisa May",1832,1888,280
37488,Asgard Stories: Tales from Norse Mythology,"Cummings, Mabel H.",0,0,280
34828,Sentimental Education,"Flaubert, Gustave",1821,1880,280
57317,The Secrets of the Self: Asrar-i Khudi - A Philosophical Poem,"Iqbal, Muhammad, Sir",1877,1938,280
33921,Cacao Culture in the Philippines,"Lyon, William Scrugham",1852,1916,280
25016,The House of Souls,"Machen, Arthur",1863,1947,280
46041,The Christian Hymn Book,,0,0,280
34089,The Celestial Omnibus and Other Stories,"Forster, E. M. (Edward Morgan)",1879,1970,279
15809,A Apple Pie,"Greenaway, Kate",1846,1901,279
44932,Free Thought and Official Propaganda,"Russell, Bertrand",1872,1970,279
2253,Henry V,"Shakespeare, William",1564,1616,279
58825,Index of the Project Gutenberg Works of Jonathan Swift,"Swift, Jonathan",1667,1745,279
2995,Tacitus on Germany,"Tacitus, Cornelius",56,117,279
20842,Dreams,"Bergson, Henri",1859,1941,278
9611,"Joseph Andrews, Vol. 1","Fielding, Henry",1707,1754,278
53259,Horton Genealogy,"Horton, Geo. F. (George Firman)",1806,1886,278
2804,Rose in Bloom: A Sequel to 'Eight Cousins',"Alcott, Louisa May",1832,1888,277
551,The Land That Time Forgot,"Burroughs, Edgar Rice",1875,1950,277
3760,Sybil,"Disraeli, Benjamin, Earl of Beaconsfield",1804,1881,277
1608,Camille (La Dame aux Camilias),"Dumas, Alexandre",1824,1895,277
26535,The Standard Electrical Dictionary,"Sloane, T. O'Conor (Thomas O'Conor)",1851,1940,277
40766,Nationalism,"Tagore, Rabindranath",1861,1941,277
22188,"The Comedies of Terence: Literally Translated into English Prose, with Notes",Terence,0,0,277
46091,The Octoroon,"Boucicault, Dion",1820,1890,276
21200,"The Letters of Cicero, Volume 1: The Whole Extant Correspodence in Chronological Order","Cicero, Marcus Tullius",-106,-43,276
51783,"The Description of a New World, Called the Blazing-World","Newcastle, Margaret Cavendish, Duchess of",0,1674,276
58710,The Land of Darkness,"Oliphant, Mrs. (Margaret)",1828,1897,276
10741,The Essays of Arthur Schopenhauer: the Wisdom of Life,"Schopenhauer, Arthur",1788,1860,276
17,The Book of Mormon,"Smith, Joseph, Jr.",1805,1844,276
7164,Gitanjali,"Tagore, Rabindranath",1861,1941,276
16772,The Story of a Soul (L'Histoire d'une Ame),"Therese, de Lisieux, Saint",1873,1897,276
23770,"Mission Furniture: How to Make It, Part 1","Windsor, H. H. (Henry Haven)",1859,1924,276
1069,Four Short Stories By Emile Zola,"Zola, Emile",1840,1902,276
58693,A Wreath of Indian Stories,A. L. O. E.,1821,1893,275
36287,The Poems and Prose Poems of Charles Baudelaire: with an Introductory Preface by James Huneker,"Baudelaire, Charles",1821,1867,275
7097,Autobiography of Ma-ka-tai-me-she-kia-kiak,"Black Hawk, Sauk chief",1767,1838,275
10661,A Selection from the Discourses of Epictetus with the Encheiridion,Epictetus,55,135,275
19368,The Mide'wiwin of the Ojibwa,"Hoffman, Walter James",1846,1899,275
20872,"The Best Short Stories of 1917, and the Yearbook of the American Short Story",,0,0,275
572,The Great Big Treasury of Beatrix Potter,"Potter, Beatrix",1866,1943,275
6960,A Narrative of the Life of Mrs. Mary Jemison,"Seaver, James E. (James Everett)",1787,1827,275
2445,Letters on England,Voltaire,1694,1778,275
1376,The Little White Bird,"Barrie, J. M. (James Matthew)",1860,1937,274
32530,Armageddon-2419 A.D.,"Nowlan, Philip Francis",1888,1940,274
13940,The Problem of China,"Russell, Bertrand",1872,1970,274
535,Travels with a Donkey in the Cevennes,"Stevenson, Robert Louis",1850,1894,274
23060,The Unknown Masterpiece: 1845,"Balzac, Honore de",1799,1850,273
1906,Erewhon,"Butler, Samuel",1835,1902,273
22472,The Book of the Damned,"Fort, Charles",1874,1932,273
31754,Devil Stories: An Anthology,,0,0,273
58682,Infinity's Child,"De Vet, Charles V. (Charles Vincent)",1911,1997,272
28698,The Crystal Crypt,"Dick, Philip K.",1928,1982,272
39635,"The Best Short Stories of 1918, and the Yearbook of the American Short Story",,0,0,272
52881,The Joyful Wisdom ('La Gaya Scienza'),"Nietzsche, Friedrich Wilhelm",1844,1900,272
14461,Letters on Demonology and Witchcraft,"Scott, Walter",1771,1832,272
27250,What I Saw in America,"Chesterton, G. K. (Gilbert Keith)",1874,1936,271
13510,"Knots, Splices and Rope Work","Verrill, A. Hyatt (Alpheus Hyatt)",1871,1954,271
2347,The Adventure of the Dying Detective,"Doyle, Arthur Conan",1859,1930,270
23495,The Story of the Greeks,"Guerber, H. A. (Helene Adeline)",1859,1929,270
47762,Records of Steam Boiler Explosions,"Marten, Edward Bindon",0,0,270
15663,Ancient Egypt,"Rawlinson, George",1812,1902,270
19362,In the Year 2889,"Verne, Michel",1861,1925,270
92,Tarzan and the Jewels of Opar,"Burroughs, Edgar Rice",1875,1950,269
32528,The Lusiad,"Camões, Luis de",0,1580,269
640,The Yellow Fairy Book,"Lang, Andrew",1844,1912,269
2003,Spirits in Bondage: A Cycle of Lyrics,"Lewis, C. S. (Clive Staples)",1898,1963,269
7864,The Mahabharata of Krishna-Dwaipayana Vyasa Translated into English Prose: Adi Parva,,0,0,269
10471,The World's Greatest Books - Volume 01 - Fiction,,0,0,269
14872,The Tale of Squirrel Nutkin,"Potter, Beatrix",1866,1943,269
32832,Piper in the Woods,"Dick, Philip K.",1928,1982,268
41214,Totem and Taboo: Resemblances Between the Psychic Lives of Savages and Neurotics,"Freud, Sigmund",1856,1939,268
2825,Undine,"La Motte-Fouque, Friedrich Heinrich Karl, Freiherr de",1777,1843,268
55749,"The Raven, and The Philosophy of Composition","Poe, Edgar Allan",1809,1849,268
28553,How it Works,"Williams, Archibald",1871,1934,268
699,A Child's History of England,"Dickens, Charles",1812,1870,267
17700,The Suppression of the African Slave Trade to the United States of America: 1638-1870,"Du Bois, W. E. B. (William Edward Burghardt)",1868,1963,267
19993,"Childhood's Favorites and Fairy Stories: The Young Folks Treasury, Volume 1",,0,0,267
25512,The Fables of Phaedrus: Literally translated into English prose with notes,Phaedrus,0,0,267
1106,The Tragedy of Titus Andronicus,"Shakespeare, William",1564,1616,267
4028,The Autobiography of Benvenuto Cellini,"Cellini, Benvenuto",1500,1571,266
711,Allan Quatermain,"Haggard, H. Rider (Henry Rider)",1856,1925,266
14658,The Road,"London, Jack",1876,1916,266
16764,"History of the Wars, Books I and II: The Persian War",Procopius,0,0,266
6885,The Indolence of the Filipino,"Rizal, Jose",1861,1896,266
11945,Essays of Schopenhauer,"Schopenhauer, Arthur",1788,1860,266
2787,An Old-Fashioned Girl,"Alcott, Louisa May",1832,1888,265
29090,The Complete Poetical Works of Samuel Taylor Coleridge. Vol 1 and 2,"Coleridge, Samuel Taylor",1772,1834,265
33670,Maxims and Reflections,"Goethe, Johann Wolfgang von",1749,1832,265
35155,The Betrothed: From the Italian of Alessandro Manzoni,"Manzoni, Alessandro",1785,1873,265
27889,"Familiar Quotations: A Collection of Passages, Phrases, and Proverbs Traced to; Their Sources in Ancient and Modern Literature",,0,0,265
23639,Plutarch's Morals,Plutarch,46,119,265
53964,The Sins of the Cities of the Plain,"Saul, Jack",1857,1904,265
1441,The Story of an African Farm,"Schreiner, Olive",1855,1920,265
4010,Marmion: A Tale Of Flodden Field,"Scott, Walter",1771,1832,265
3672,The 2000 CIA World Factbook,United States. Central Intelligence Agency,0,0,265
26558,Pennsylvania Dutch Cooking,Unknown,0,0,265
21300,"Cowboy Songs, and Other Frontier Ballads",Various,0,0,265
12915,The White Devil,"Webster, John",0,0,265
4351,The English Constitution,"Bagehot, Walter",1826,1877,264
3804,Pierre and Jean,"Maupassant, Guy de",1850,1893,264
16042,The Wonder Book of Bible Stories,,0,0,264
13015,Tales of Old Japan,"Redesdale, Algernon Bertram Freeman-Mitford, Baron",1837,1916,264
6798,Aesthetical Essays of Friedrich Schiller,"Schiller, Friedrich",1759,1805,264
19229,Anticipations: Of the Reaction of Mechanical and Scientific Progress upon Human life and Thought,"Wells, H. G. (Herbert George)",1866,1946,264
10459,The Celtic Twilight,"Yeats, W. B. (William Butler)",1865,1939,264
173,The Insidious Dr. Fu Manchu,"Rohmer, Sax",1883,1959,263
58599,The Devil and Parson Church,Anonymous,0,0,262
10935,The Wonderful Adventures of Nils,"Lagerlof, Selma",1858,1940,262
44653,A Latin Grammar for Schools and Colleges,"Lane, George Martin",1823,1897,262
38049,"Louisa May Alcott : Her Life, Letters, and Journals","Alcott, Louisa May",1832,1888,261
559,Greenmantle,"Buchan, John",1875,1940,261
10743,Moonfleet,"Falkner, John Meade",1858,1932,261
5314,Household Tales by Brothers Grimm,"Grimm, Wilhelm",1786,1859,261
48433,Kant's Critique of Judgement,"Kant, Immanuel",1724,1804,261
10378,Autobiography,"Mill, John Stuart",1806,1873,261
5342,The Story Girl,"Montgomery, L. M. (Lucy Maud)",1874,1942,261
24878,"Lucy Maud Montgomery Short Stories, 1909 to 1922","Montgomery, L. M. (Lucy Maud)",1874,1942,261
40986,"The Oera Linda Book, from a Manuscript of the Thirteenth Century",,0,0,261
17366,"Notes on Nursing: What It Is, and What It Is Not","Nightingale, Florence",1820,1920,261
9411,Legends of the Gods: The Egyptian Texts,"Budge, E. A. Wallis (Ernest Alfred Wallis), Sir",1857,1934,260
820,Edison: His Life and Inventions,"Martin, Thomas Commerford",1856,1924,260
10643,The World's Greatest Books - Volume 02 - Fiction,,0,0,260
26638,Pictorial Composition and the Critical Judgment of Pictures,"Poore, Henry Rankin",1859,1940,260
22814,A Practical Guide to Self-Hypnosis,"Powers, Melvin",1922,0,260
13334,The Collected Works of Ambrose Bierce - Volume 2: In the Midst of Life: Tales of Soldiers and Civilians,"Bierce, Ambrose",1842,1913,259
5060,Six Short Plays,"Galsworthy, John",1867,1933,259
34229,Steel Traps,"Harding, A. R. (Arthur Robert)",1871,1930,259
1365,The Complete Poetical Works of Henry Wadsworth Longfellow,"Longfellow, Henry Wadsworth",1807,1882,259
11659,The World's Greatest Books - Volume 08 - Fiction,,0,0,259
4023,Candida,"Shaw, Bernard",1856,1950,259
22748,Explanation of Terms Used in Entomology,"Smith, John Bernhard",1858,1912,259
44881,Confessions of a Thug,"Taylor, Meadows",1808,1876,259
58726,Small Talk at Wreyland. First Series,"Torr, Cecil",0,0,259
19002,Alice's Adventures Under Ground,"Carroll, Lewis",1832,1898,258
18590,The Letters of Cassiodorus,"Cassiodorus, Senator",484,580,258
2343,The Adventure of Wisteria Lodge,"Doyle, Arthur Conan",1859,1930,258
4014,Arsene Lupin,"Leblanc, Maurice",1864,1941,258
471,The Bride of Lammermoor,"Scott, Walter",1771,1832,258
7176,A Letter to a Hindu,"Tolstoy, Leo, graf",1828,1910,258
29228,The Contrast,"Tyler, Royall",1757,1826,258
887,Intentions,"Wilde, Oscar",1854,1900,258
58849,Steam Navigation and Its Relation to the Commerce of Canada and the United States,"Croil, James",0,0,257
38973,"Lace, Its Origin and History","Goldenberg, Samuel L.",0,0,257
58639,Welcome Martians!,"Hunter, Evan",1926,2005,257
50543,Short Stories for High Schools,,0,0,257
1028,The Professor,"Bronte, Charlotte",1816,1855,256
26240,The Clansman: An Historical Romance of the Ku Klux Klan,"Dixon, Thomas",1864,1946,256
2346,The Adventure of the Bruce-Partington Plans,"Doyle, Arthur Conan",1859,1930,256
16406,An Introduction to Philosophy,"Fullerton, George Stuart",1859,1925,256
211,The Aspern Papers,"James, Henry",1843,1916,256
3310,A Forgotten Empire (Vijayanagar): A Contribution to the History of India,"Nunes, Fernao",0,0,256
3688,The Chronicles of Clovis,Saki,1870,1916,256
21020,The Little Clay Cart: Mrcchakatika,Sudraka,0,0,256
14417,The Agamemnon of Aeschylus: Translated into English Rhyming Verse with Explanatory Notes,Aeschylus,-525,-456,255
8677,Behind a Mask,"Alcott, Louisa May",1832,1888,255
955,The Patchwork Girl of Oz,"Baum, L. Frank (Lyman Frank)",1856,1919,255
16341,Poems by William Cullen Bryant,"Bryant, William Cullen",1794,1878,255
8861,"The Works of Lord Byron, Vol. 1. Poetry","Byron, George Gordon Byron, Baron",1788,1824,255
39250,Myths of Greece and Rome,"Guerber, H. A. (Helene Adeline)",1859,1929,255
7514,A Guide to Stoicism,"Stock, St. George William Joseph",1850,0,255
16927,"Tacitus: The Histories, Volumes I and II","Tacitus, Cornelius",56,117,255
42401,Vathek; An Arabian Tale,"Beckford, William",1760,1844,254
7829,American Prisoners of the Revolution,"Dandridge, Danske",1858,1914,254
14814,The Tale of Jemima Puddle-Duck,"Potter, Beatrix",1866,1943,254
101,The Hacker Crackdown: Law and Disorder on the Electronic Frontier,"Sterling, Bruce",1954,0,254
773,"Lord Arthur Savile's Crime; The Portrait of Mr. W.H., and Other Stories","Wilde, Oscar",1854,1900,254
4116,Christopher Columbus and the New World of His Discovery - Complete,"Young, Filson",1876,1938,254
37494,The Gospel According To Peter: A Study,"Cassels, Walter Richard",1826,1907,253
30323,The Book of Religions,"Hayward, John",1781,1869,253
2802,Ramona,"Jackson, Helen Hunt",1830,1885,253
1640,Lilith: A Romance,"MacDonald, George",1824,1905,253
30508,The Instruction of Ptah-Hotep and the Instruction of Ke'Gemni: The Oldest Books in the World,Ptahhotep,0,0,253
37090,Our Knowledge of the External World as a Field for Scientific Method in Philosophy,"Russell, Bertrand",1872,1970,253
1947,Scaramouche: A Romance of the French Revolution,"Sabatini, Rafael",1875,1950,253
10001,Apocolocyntosis,"Seneca, Lucius Annaeus",0,65,253
485,The Road to Oz,"Baum, L. Frank (Lyman Frank)",1856,1919,252
90,The Son of Tarzan,"Burroughs, Edgar Rice",1875,1950,252
23772,Devotions Upon Emergent Occasions; Together with Death's Duel,"Donne, John",1572,1631,252
3725,Famous Men of the Middle Ages,"Haaren, John H. (John Henry)",1855,1916,252
22420,The Book of Nature Myths,"Holbrook, Florence",1860,1932,252
37841,"Human, All-Too-Human: A Book for Free Spirits, Part 2","Nietzsche, Friedrich Wilhelm",1844,1900,252
2400,"Vikram and the Vampire: Classic Hindu Tales of Adventure, Magic, and Romance","Burton, Richard Francis, Sir",1821,1890,251
42686,"A History of Epidemics in Britain, Volume 1 (of 2): From A.D. 664 to the Extinction of Plague","Creighton, Charles",1847,1927,251
54401,A Woman In China,"Gaunt, Mary",1861,1942,251
10616,"An Essay Concerning Humane Understanding, Volume 2","Locke, John",1632,1704,251
19,The Song of Hiawatha,"Longfellow, Henry Wadsworth",1807,1882,251
770,The Story of the Treasure Seekers: Being the Adventures of the Bastable Children in Search of a Fortune,"Nesbit, E. (Edith)",1858,1924,251
39316,The Loyalists of Massachusetts and the Other Side of the American Revolution,"Stark, James Henry",0,0,251
126,The Poison Belt,"Doyle, Arthur Conan",1859,1930,250
2777,Cabbages and Kings,"Henry, O.",1862,1910,250
33224,Principles of Geology,"Lyell, Charles, Sir",1797,1875,250
36853,A Very Naughty Girl,"Meade, L. T.",1854,1914,250
18674,A Chinese Wonder Book,"Pitman, Norman Hinsdale",1876,1925,250
1735,Sophist,Plato,-428,-348,250
11615,The Grammar of English Grammars,"Brown, Goold",1791,1857,249
106,Jungle Tales of Tarzan,"Burroughs, Edgar Rice",1875,1950,249
53535,Common Trees of Pennsylvania,"Ibberson, Joseph E.",1917,0,249
9660,The First Blast of the Trumpet against the monstrous regiment of Women,"Knox, John",0,1572,249
729,"Hackers, Heroes of the Computer Revolution: Chapters 1 and 2","Levy, Steven",1951,0,249
19926,Standard Selections,,0,0,249
23673,The St. Gregory Hymnal and Catholic Choir Book,,0,0,249
43348,"The Paston Letters, A.D. 1422-1509. Volume 1 (of 6): New Complete Library Edition",,0,0,249
2272,The Discovery of Guiana,"Raleigh, Walter",0,1618,249
12815,"American Cookery: The Art of Dressing Viands, Fish, Poultry, and Vegetables","Simmons, Amelia",0,0,249
15408,"Three Lives: Stories of The Good Anna, Melanctha and The Gentle Lena","Stein, Gertrude",1874,1946,249
125,A Girl of the Limberlost,"Stratton-Porter, Gene",1863,1924,249
38067,A Select Collection of Valuable and Curious Arts and Interesting Experiments,Unknown,0,0,249
873,A House of Pomegranates,"Wilde, Oscar",1854,1900,249
48105,"Dictionary of Quotations from Ancient and Modern, English and Foreign Sources","Wood, James, Rev.",0,0,249
8446,The Enormous Room,"Cummings, E. E. (Edward Estlin)",1894,1962,248
49461,Bartholomew Fair: A Comedy,"Jonson, Ben",0,1637,248
1743,Twelve Stories and a Dream,"Wells, H. G. (Herbert George)",1866,1946,248
961,Glinda of Oz,"Baum, L. Frank (Lyman Frank)",1856,1919,247
28961,Cuore (Heart): An Italian Schoolboy's Journal,"De Amicis, Edmondo",1846,1908,247
32596,The Revolt of the Angels,"France, Anatole",1844,1924,247
706,The Amateur Cracksman,"Hornung, E. W. (Ernest William)",1866,1921,247
12587,The Man Who Laughs: A Romance of English History,"Hugo, Victor",1802,1885,247
1154,The Voyages of Doctor Dolittle,"Lofting, Hugh",1886,1947,247
19690,Apologia pro Vita Sua,"Newman, John Henry",1801,1890,247
4519,The Descent of Man and Other Stories,"Wharton, Edith",1862,1937,247
1171,The Apology,Xenophon,-431,-355,247
17797,Memoir of Jane Austen,"Austen-Leigh, James Edward",1798,1874,246
18459,Hypnerotomachia: The Strife of Loue in a Dreame,"Colonna, Francesco",0,1527,246
2609,The Vicomte De Bragelonne,"Dumas, Alexandre",1802,1870,246
14313,One of the 28th: A Tale of Waterloo,"Henty, G. A. (George Alfred)",1832,1902,246
58465,Gypsy Sorcery and Fortune Telling,"Leland, Charles Godfrey",1824,1903,246
48193,"Commentary on Genesis, Vol. 1: Luther on the Creation","Luther, Martin",1483,1546,246
1787,Hamlet,"Shakespeare, William",1564,1616,246
17845,"Salem Witchcraft, Volumes I and II","Upham, Charles Wentworth",1802,1875,246
58718,Bobby Blake in the Frozen North: The Old Eskimo's Last Message,"Warner, Frank A.",0,0,246
14006,An English Grammar,"Baskervill, William Malone",1850,1899,245
7785,Leonardo Da Vinci,"Brockwell, Maurice W.",1869,1958,245
10684,A History of Freedom of Thought,"Bury, J. B. (John Bagnell)",1861,1927,245
18971,"Jacobean Embroidery: Its Forms and Fillings, Including Late Tudor","Hands, A. F. Morris",0,0,245
58821,"The Works of Theodore Roosevelt, Volume 12 (of 14): The Strenuous Life","Roosevelt, Theodore",1858,1919,245
8190,A Wodehouse Miscellany: Articles & Stories,"Wodehouse, P. G. (Pelham Grenville)",1881,1975,245
54726,The Ladies' Paradise,"Zola, Emile",1840,1902,245
24979,A Source Book for Ancient Church History,"Ayer, Joseph Cullen",1866,1944,244
30568,"Kipling Stories and Poems Every Child Should Know, Book II","Kipling, Rudyard",1865,1936,244
51233,The Marching Morons,"Kornbluth, C. M. (Cyril M.)",1923,1958,244
18972,Zadig,Voltaire,1694,1778,244
31565,Index of the Project Gutenberg Works of Balzac,"Balzac, Honore de",1799,1850,243
6408,Letters of Anton Chekhov to His Family and Friends,"Chekhov, Anton Pavlovich",1860,1904,243
13347,Wildflowers of the Farm,"Cooke, Arthur O. (Arthur Owens)",1867,1930,243
2349,The Adventure of the Devil's Foot,"Doyle, Arthur Conan",1859,1930,243
31377,Weird Tales. Vol. 1 (of 2),"Hoffmann, E. T. A. (Ernst Theodor Amadeus)",1776,1822,243
4264,The Golden Bowl - Complete,"James, Henry",1843,1916,243
8120,"The Life of St. Teresa of Jesus, of the Order of Our Lady of Carmel","Teresa, of Avila, Saint",1515,1582,243
3431,The Gadfly,"Voynich, E. L. (Ethel Lillian)",1864,1960,243
16726,Four Weird Tales,"Blackwood, Algernon",1869,1951,242
2064,A Journey to the Western Islands of Scotland,"Johnson, Samuel",1709,1784,242
4239,An Essay on the Principle of Population,"Malthus, T. R. (Thomas Robert)",1766,1834,242
16247,Famous Stories Every Child Should Know,,0,0,242
426,Tales and Fantasies,"Stevenson, Robert Louis",1850,1894,242
2480,Under Western Eyes,"Conrad, Joseph",1857,1924,241
22943,The Nebuly Coat,"Falkner, John Meade",1858,1932,241
5347,Understood Betsy,"Fisher, Dorothy Canfield",1879,1958,241
58611,"New Hampshire, A Poem; with Notes and Grace Notes","Frost, Robert",1874,1963,241
4047,The Leavenworth Case,"Green, Anna Katharine",1846,1935,241
11984,A Pluralistic Universe: Hibbert Lectures at Manchester College on the Present Situation in Philosophy,"James, William",1842,1910,241
50316,The Fables of La Fontaine,"La Fontaine, Jean de",1621,1695,241
12254,Illustrated History of Furniture: From the Earliest to the Present Time,"Litchfield, Frederick",1850,1930,241
25942,The Translations of Beowulf: A Critical Bibliography,"Tinker, Chauncey Brewster",1876,1963,241
38593,"The History of the Knights Templars, the Temple Church, and the Temple","Addison, C. G. (Charles Greenstreet)",0,1866,240
2298,Great Astronomers,"Ball, Robert S. (Robert Stawell)",1840,1913,240
54487,Waterfowl Identification Guide,Central Flyway Council,0,0,240
37036,The Key to Success,"Conwell, Russell H.",1843,1925,240
177,The American,"James, Henry",1843,1916,240
1980,Stories by English Authors: Africa (Selected by Scribners),,0,0,240
51161,Degeneration,"Nordau, Max Simon",1849,1923,240
166,Summer,"Wharton, Edith",1862,1937,240
44,The Song of the Lark,"Cather, Willa",1873,1947,239
914,The Uncommercial Traveller,"Dickens, Charles",1812,1870,239
16831,The Improvement of Human Reason: Exhibited in the Life of Hai Ebn Yokdhan,"Ibn Tufayl, Muhammad ibn 'Abd al-Malik",0,1185,239
225,At the Back of the North Wind,"MacDonald, George",1824,1905,239
37955,"The Life and Letters of Mary Wollstonecraft Shelley, Volume 1 (of 2)","Marshall, Julian, Mrs.",1843,1922,239
58845,Index of the Project Gutenberg Works of Alexander Pope,"Pope, Alexander",1688,1744,239
15041,The Negro Problem,Various Authors,0,0,239
1715,Eugenie Grandet,"Balzac, Honore de",1799,1850,238
1949,On the Ruin of Britain,Gildas,0,0,238
29614,The Game of Rat and Dragon,"Linebarger, Paul Myron Anthony",1913,1966,238
1346,The Eighteenth Brumaire of Louis Bonaparte,"Marx, Karl",1818,1883,238
1270,In Defense of Women,"Mencken, H. L. (Henry Louis)",1880,1956,238
39537,Medieval English Nunneries c. 1275 to 1535,"Power, Eileen",1889,1940,238
